{"contract": {"name": "receipt", "version": "v1"}, "receipt_id": "rcpt_c2d3a8361dc141f68d1bd5af27402fb6", "intent_id": "act_3ffbabb7ee4b418c", "occurred_at": "2026-10-03T00:36:32.211147Z", "outcome": "executed", "tenant": {"tenant_id": "default"}, "subject": {"type": "agent", "id": "agent-e2e"}, "action": {"name": "payments.refund", "capability": "payments.refund", "parameters": {"amount_minor": 2500, "currency": "EUR"}}, "target": {"resource_type": "tool", "resource_id": "ch_e2e_1"}, "summary": "The protected action executed successfully.", "phase": "execution", "correlation": {"pccb_id": "pccb_1158bad15fdc423899bd4eef0235b898", "request_id": "req_gate_e1101bcd0173467a8d0f180f65ed76ca", "action_hash": {"algorithm": "sha-256", "canonicalization": "ACTENON-JCS-STRICT-1", "value": "3ef2f4e6814cf862eb4de9e6c95ab5124c40b4490266cb8bec0df3b178984db1"}}, "side_effects": {"state": "completed"}, "details": {"refunded": true, "brokered_credential": {"credential_id": "cred_b244aa1fabee4821b672800553b4e2e6", "issued_at": "2026-10-03T00:36:32.211147Z", "expires_at": "2026-10-03T00:38:31.957286Z", "scope": ["payments.refund"], "metadata": {"broker": "in_memory", "intent_id": "act_3ffbabb7ee4b418c", "pccb_id": "pccb_1158bad15fdc423899bd4eef0235b898", "audience": {"type": "service", "id": "actenon-permit-gateway"}, "capability": "payments.refund"}, "secret_reference": "memory://brokered-credential/cred_b244aa1fabee4821b672800553b4e2e6"}, "credential_broker": {"mode": "protected_endpoint", "credential_material_exposed": false}}}