{"contract": {"name": "receipt", "version": "v1"}, "receipt_id": "rcpt_d93af5f438ac433da6972b59a42fa357", "intent_id": "act_5a8b7acf109546b5", "occurred_at": "2026-10-03T13:20:39.937384Z", "outcome": "executed", "tenant": {"tenant_id": "default"}, "subject": {"type": "agent", "id": "agent-e2e"}, "action": {"name": "payments.refund", "capability": "payments.refund", "parameters": {"amount_minor": 2500, "currency": "EUR"}}, "target": {"resource_type": "tool", "resource_id": "ch_e2e_1"}, "summary": "The protected action executed successfully.", "phase": "execution", "correlation": {"pccb_id": "pccb_6a58bd0f11d544f4b5dce394024f9040", "request_id": "req_gate_007b4d1ab94647ad8d07a4ddd3c01113", "action_hash": {"algorithm": "sha-256", "canonicalization": "ACTENON-JCS-STRICT-1", "value": "ab93fd86b11ad4fbeac76212035e7deff83f229070ec1e6ccd8c64b9a0d25276"}}, "side_effects": {"state": "completed"}, "details": {"refunded": true, "brokered_credential": {"credential_id": "cred_c44b007d53274390b9772fbdd1c1aeac", "issued_at": "2026-10-03T13:20:39.937384Z", "expires_at": "2026-10-03T13:22:39.572831Z", "scope": ["payments.refund"], "metadata": {"broker": "in_memory", "intent_id": "act_5a8b7acf109546b5", "pccb_id": "pccb_6a58bd0f11d544f4b5dce394024f9040", "audience": {"type": "service", "id": "actenon-permit-gateway"}, "capability": "payments.refund"}, "secret_reference": "memory://brokered-credential/cred_c44b007d53274390b9772fbdd1c1aeac"}, "credential_broker": {"mode": "protected_endpoint", "credential_material_exposed": false}}}