{"contract": {"name": "receipt", "version": "v1"}, "receipt_id": "rcpt_d5e23ed72ebd4320b19d33851d8834b5", "intent_id": "act_2c62dc014d6f404a", "occurred_at": "2026-10-03T00:19:00.428065Z", "outcome": "executed", "tenant": {"tenant_id": "default"}, "subject": {"type": "agent", "id": "agent-e2e"}, "action": {"name": "payments.refund", "capability": "payments.refund", "parameters": {"amount_minor": 2500, "currency": "EUR"}}, "target": {"resource_type": "tool", "resource_id": "ch_e2e_1"}, "summary": "The protected action executed successfully.", "phase": "execution", "correlation": {"pccb_id": "pccb_c1b2e89d78f149cd9ddf084b73ddedb2", "request_id": "req_gate_7bb934b5a96c4cf49cd2e104e58bd184", "action_hash": {"algorithm": "sha-256", "canonicalization": "ACTENON-JCS-STRICT-1", "value": "54d85d6ef989aa7e5db5bd5f3c664d828a344ea4ebb889f38f54e243f1a8383b"}}, "side_effects": {"state": "completed"}, "details": {"refunded": true, "brokered_credential": {"credential_id": "cred_d0e439c5f7f54562be50de1d5f3f37cb", "issued_at": "2026-10-03T00:19:00.428065Z", "expires_at": "2026-10-03T00:21:00.096988Z", "scope": ["payments.refund"], "metadata": {"broker": "in_memory", "intent_id": "act_2c62dc014d6f404a", "pccb_id": "pccb_c1b2e89d78f149cd9ddf084b73ddedb2", "audience": {"type": "service", "id": "actenon-permit-gateway"}, "capability": "payments.refund"}, "secret_reference": "memory://brokered-credential/cred_d0e439c5f7f54562be50de1d5f3f37cb"}, "credential_broker": {"mode": "protected_endpoint", "credential_material_exposed": false}}}