{"contract": {"name": "receipt", "version": "v1"}, "receipt_id": "rcpt_e9e947ff25db4a2d99a8e3536dcbc3d2", "intent_id": "act_bb6a61a004a248e1", "occurred_at": "2026-10-03T13:20:23.632642Z", "outcome": "executed", "tenant": {"tenant_id": "default"}, "subject": {"type": "agent", "id": "agent-e2e"}, "action": {"name": "payments.refund", "capability": "payments.refund", "parameters": {"amount_minor": 2500, "currency": "EUR"}}, "target": {"resource_type": "tool", "resource_id": "ch_e2e_1"}, "summary": "The protected action executed successfully.", "phase": "execution", "correlation": {"pccb_id": "pccb_69b77e83a7d342d7b0dde12614d3a8d1", "request_id": "req_gate_cc7786efb98b40eca63bcc85f6d8c719", "action_hash": {"algorithm": "sha-256", "canonicalization": "ACTENON-JCS-STRICT-1", "value": "b7657cd036ef46d81f133c0abc6268193c8e27afa6f440bb3ff4ffe6dc77cee1"}}, "side_effects": {"state": "completed"}, "details": {"refunded": true, "brokered_credential": {"credential_id": "cred_961a12e6afda4669bd656dc08bda595e", "issued_at": "2026-10-03T13:20:23.632642Z", "expires_at": "2026-10-03T13:22:23.331549Z", "scope": ["payments.refund"], "metadata": {"broker": "in_memory", "intent_id": "act_bb6a61a004a248e1", "pccb_id": "pccb_69b77e83a7d342d7b0dde12614d3a8d1", "audience": {"type": "service", "id": "actenon-permit-gateway"}, "capability": "payments.refund"}, "secret_reference": "memory://brokered-credential/cred_961a12e6afda4669bd656dc08bda595e"}, "credential_broker": {"mode": "protected_endpoint", "credential_material_exposed": false}}}