{
  "action": {
    "capability": "refund.execute",
    "name": "refund.create",
    "parameters": {
      "amount_minor": 1000,
      "currency": "USD"
    }
  },
  "contract": {
    "name": "receipt",
    "version": "v1"
  },
  "correlation": {
    "action_hash": {
      "algorithm": "sha-256",
      "canonicalization": "RFC8785-JCS",
      "value": "a2df0ff9a688450b00509762f2624e027b3956f65a8fdf2a97987db2b2c5e186"
    },
    "escrow_id": "esc_sim_replay_001",
    "pccb_id": "pccb_sim_replay_001",
    "refusal_id": "rfsl_sim_replay_001",
    "request_id": "req_sim_replay_001"
  },
  "details": {
    "amount_minor": 1000,
    "currency": "USD",
    "target_resource_id": "pay_001",
    "target_resource_type": "payment",
    "wedge": "refund"
  },
  "intent_id": "intent_sim_replay_001",
  "occurred_at": "2026-01-01T12:00:00Z",
  "outcome": "refused",
  "phase": "execution",
  "reason_codes": [
    "DUPLICATE_REPLAY"
  ],
  "receipt_id": "rcpt_sim_replay_0003",
  "side_effects": {
    "state": "none"
  },
  "subject": {
    "id": "actor_123",
    "type": "service"
  },
  "summary": "Refund of 1000 USD against payment pay_001 was refused.",
  "target": {
    "resource_id": "pay_001",
    "resource_type": "payment"
  },
  "tenant": {
    "tenant_id": "tenant_alpha"
  }
}
